document1,document2,label,antecedent,
신랑이 하면 내가 안 된다고 그래버리고.,그놈이가 이거 해야지 니 낫은다고. 그러고 ,,그놈이,
요거 한 것만 알아요.,그러면 이날 이 사람이 했던 말들을 좀 다 얘기해 주시겠어요. ,,사람,
하기 싫다고,"음, 이거 한 것만 알아요. 이거 하는 과정에서 그러면 김○○ 씨가 한 말이나 행동 같은 게 있어요. ",,김○○,
싫다고 싫다고 안 한다고 그랬는데,"음, 이거 한 것만 알아요. 이거 하는 과정에서 그러면 김○○ 씨가 한 말이나 행동 같은 게 있어요. 
하기 싫다고 다리  ",,김○○,
바지 벗겼어. ,그러면 제가 그걸 그 과정을 조금 더 잘 알고 싶어서. 이 사람이 그러면 이렇게 마사지를 하다가 갑자기 ,,사람,
쫄바지를 벗겼어. ,"그 말은 생각 안 나고, 행동은 이걸. 그 김동수 머리가 없어요. 가발이요. 
아, 가발이에요. 
예, 그래서  음~. 그리고 이렇게 이렇게 이렇게 이렇게. 배가 볼록 나왔어. 엉덩이 볼록하고. 날 더울 때라 그래요. 치마 입고 이렇게 치마 입고. 바지를 벗겼어. 쫄이바지가. 
쫄쫄이 바지. 
쫄이바지. 
쫄이바지. 
쫄 쪼…. 이렇게 ‘쫄’이에요? 
음 음, 쫄. ",,김동수,
억지로 했어. ,"그 말은 생각 안 나고, 행동은 이걸. 그 김동수 머리가 없어요. 가발이요. 
아, 가발이에요. 
예, 그래서  음~. 그리고 이렇게 이렇게 이렇게 이렇게. 배가 볼록 나왔어. 엉덩이 볼록하고. 날 더울 때라 그래요. 치마 입고 이렇게 치마 입고. 바지를 벗겼어. 쫄이바지가. 
쫄쫄이 바지. 
쫄이바지. 
쫄이바지. 
쫄 쪼…. 이렇게 ‘쫄’이에요? 
음 음, 쫄. 
쫄바지를 벗겼어. 
응, 벗겼어요. 
바지. 그래서 이게 나는 그렇게 안 하고 싶은데 ",,김동수,
다 벗고,"이 사람이 먼저 옷을 다 벗었어요. 
응. 옷 ",,사람,
바지를 벗겨붓어.,"이 사람이 먼저 옷을 다 벗었어요. 
응. 옷 다 벗고 나는 이 웃투리는 안 벗고",,사람,
벗겼어. ,팬티도 이놈이가 해붓어. ,,이놈이,
벗겨불고,"팬티도 이놈이가 해붓어. 벗겼어. 
그러니까 쫄바지를 벗기고 팬티를 벗긴 거예요, 아니면 뭐 팬티랑 쫄바지를 같이 벗긴 거예요. 
이걸 이렇게 같이.
아, 같이 잡고 벗겼고. 
응.
벗긴 다음에 ",,이놈이,
이걸 옇었어. ,"벗겨불고 이걸 안 하고 나는 허리만 한다고 했는데 이 새끼가 거짓말 했어.
응, 그렇게 해서 
그래서  ",,새끼,
문 째려보면서 자라고,"벗겨불고 이걸 안 하고 나는 허리만 한다고 했는데 이 새끼가 거짓말 했어.
응, 그렇게 해서 
그래서 이걸 옇었어. 
넣었어요. 
옇었는데 애가 깼어서",,새끼,
푹 옇었어. ,"벗겨불고 이걸 안 하고 나는 허리만 한다고 했는데 이 새끼가 거짓말 했어.
응, 그렇게 해서 
그래서 이걸 옇었어. 
넣었어요. 
옇었는데 애가 깼어서 문 째려보면서 자라고 그래서 ",,새끼,
그걸 해붓어요.,"벗겨불고 이걸 안 하고 나는 허리만 한다고 했는데 이 새끼가 거짓말 했어.
응, 그렇게 해서 
그래서 이걸 옇었어. 
넣었어요. 
옇었는데 애가 깼어서 문 째려보면서 자라고 그래서 푹 옇었어. 
‘푹’ 그런 다음에. ",,새끼,
다리 이렇게 올려서. ,"벗겨불고 이걸 안 하고 나는 허리만 한다고 했는데 이 새끼가 거짓말 했어.
응, 그렇게 해서 
그래서 이걸 옇었어. 
넣었어요. 
옇었는데 애가 깼어서 문 째려보면서 자라고 그래서 푹 옇었어. 
‘푹’ 그런 다음에. 
그걸 해붓어요. 
그렇게 해서 ",,새끼,
그런 말은 안 했어. ,"그 하기 싫다고 하면서 ○○ 씨가 했던 행동이나 뭐 말이나 이런 게 더, 더 했던 말이나 이런 게 있어요. ",,○○ 씨,
이거 할 때 욕을 했어.,그러면 이 사람이 뭐,,사람,
계속 욕을 했어. ,"그러면 이 사람이 뭐
이거 할 때 욕을 했어. 욕. 
욕을 했어요. ",,사람,
"욕을 어떻게 했냐 하면,","그러면 이 사람이 뭐
이거 할 때 욕을 했어. 욕. 
욕을 했어요. 
계속 욕을 했어. 
계속 욕했어요. 
응. 
뭐라고. 
나 부르네. 이 씹할 놈아. 욕. 욕 저기 욕해요. 
계속 욕했어요. 어떤 욕들을 한 거예요. ",,사람,
기분이 안 좋아. ,그랬을 때 어땠어요 김○○ 씨.,,김○○,
“너 안 하면 니 딸이 한다”고.,"하기 싫다고 한 다음에, 하기 싫다고 하면서 뭐 이 사람을 밀치거나 뭐 못하게 하거나 뭐 한 행동 같은 것들이 있는지 아니면 뭐 또 다른 하지 말라고 이렇게 좀 계속 했던 무슨 말들 같은 게 있는지 이런 걸 물어보는 거예요. 
아, 그거요? ",,사람,
딸을 한다고 했어. ,"하기 싫다고 한 다음에, 하기 싫다고 하면서 뭐 이 사람을 밀치거나 뭐 못하게 하거나 뭐 한 행동 같은 것들이 있는지 아니면 뭐 또 다른 하지 말라고 이렇게 좀 계속 했던 무슨 말들 같은 게 있는지 이런 걸 물어보는 거예요. 
아, 그거요? “너 안 하면 니 딸이 한다”고. ",,사람,
하고,그러면 이렇게 했어요. 그럼 그때 어떻게 끝내게 된 거예요 이 사람이 하다가. ,,사람,
나 바쁘다고 슉 가붓어.,"그러면 이렇게 했어요. 그럼 그때 어떻게 끝내게 된 거예요 이 사람이 하다가. 
하고 ",,사람,
과일 같은 거 안 깎은 거 같아요. ,저녁 때 한 번씩 강아지가 거실에 있어서 강아지를 보려고 나가면 항상 앉아서 노트북을 했는데 그 사람이. 엄마도 옆에서 과일 같은 거 깎고 있고 그러거나. 그냥 옆에 앉아있는데 엄마도. ,,엄마,
제 가슴을 계속 쳤어요.,"그니까 엄마도 암튼 옆에 있었는데 제 무슨 얘기를 하다가 갑자기 그 사람이 제 가슴을 만두라고 하면서 옆으로, 암튼",,사람,
아빠랑 살고 있었는데,"그러면 내가 조금 물어볼게요. OO가 그 사람이라고 표현을 하고 있는데 그 사람이 누구예요?
새아버지요.
그럼 지금은 같이 오신 분은.
친아빠.
새아빠랑은 언제부터 같이 살았어요?
저 엄청 3학년? 그때부터 살지는 않았고, 그때는 ",,OO,
"그냥 화가 많고,",어떤 사람이에요?,,사람,
좀 말을 험하게 하는 사람?,"어떤 사람이에요?
그냥 화가 많고, ",,사람,
약간 밖에서와 안에서와의 차이가 많이 나는 사람.,"어떤 사람이에요?
그냥 화가 많고, 좀 말을 험하게 하는 사람? ",,사람,
“하지 마.” 이런 식.,그런 얘기들 할 때 오빠들 반응은 어땠어? 오빠들 같이 있을 때.,,오빠들,
"진짜 듣기 싫다고, 짜증내고","그런 얘기들 할 때 오빠들 반응은 어땠어? 오빠들 같이 있을 때.
“하지 마.” 이런 식. ",,오빠들,
"“또 저 소리다.”고 하면서 그냥 안 듣는 척하고,",그럼 OO는 어떻게 반응 했어?,,OO,
그냥 밖에서 밥만 먹고.,"그럼 OO는 어떻게 반응 했어?
“또 저 소리다.”고 하면서 그냥 안 듣는 척하고, ",,OO,
"방에 들어가고,","그럼 동생은 어떻게 반응했어?
동생 “아, 짜증나”이러면서 그냥 아예 밥 안 먹고 ",,동생,
빨리 밥 먹고.,"동생 “아, 짜증나”이러면서 그냥 아예 밥 안 먹고 방에 들어가고, 나는 그냥 밥 먹고 들어가거나, ",,나,
굴하지 않고 계속 말 했던 거 같애요.,"가족들이 그런 반응을 할 때 그 사람의 반응은 어땠어?
그게 그냥 그래도 굴",,사람,
별로 안 좋았어요.,엄마랑 새아빠는 관계가 어땠어?,,관계,
좋을 때는 되게 좋았다가,"엄마랑 새아빠는 관계가 어땠어?
별로 안 좋았어요. ",,관계,
안 좋을 때는 되게 안 좋고.,"엄마랑 새아빠는 관계가 어땠어?
별로 안 좋았어요. 좋을 때는 되게 좋았다가 ",,관계,
그냥 제 무슨 얘기를 하고 있었고,"셋이. 엄마랑, 새아빠, 저. 강아지도 있었고.
그러면 만두라고 하기 전에는 뭐하고 있었어?
제가 그냥 나가서... 기억 안나요. ",,새아빠,
기억이 안나요.,저에 관한 얘기였는데 뭐라고 얘기를 했는데 ,,저,
가슴을 만두라고 얘기하면서.,"셋이. 엄마랑, 새아빠, 저. 강아지도 있었고.
그러면 만두라고 하기 전에는 뭐하고 있었어?
제가 그냥 나가서... 기억 안나요. 그냥 제 무슨 얘기를 하고 있었고,
혹시 그게 무슨 얘기였을까.
저에 관한 얘기였는데 뭐라고 얘기를 했는데 기억이 안나요.
그러면 이 만두라고 했다는 게 무슨 말이야? 만두?",,새아빠,
그냥 기분 나빠서,그러면 그 얘기를 들었을 때 OO는?,,OO,
바로 방에 들어갔던 거 같아요.,"그러면 그 얘기를 들었을 때 OO는?
그냥 기분 나빠서 ",,OO,
옆에 있는데,"그러면 그 얘기를 들었을 때 OO는?
그냥 기분 나빠서 바로 방에 들어갔던 거 같아요.
그러면 그 사람이 만두라고 하면서 아까 계속 쳤다고 했거든. 어떻게 했다는 거야?
이렇게",,OO,
"쳤던 거 같아요,","그러면 그 사람이 만두라고 하면서 아까 계속 쳤다고 했거든. 어떻게 했다는 거야?
이렇게 옆에 있는데 ",,사람,
하지 말라고 하면서,그럼 그렇게 칠 때 OO는?,,OO,
그냥 일어나서 들어갔어요.,"그럼 그렇게 칠 때 OO는?
하지 말라고 하면서 ",,OO,
모르겠어요.,"그럼 그렇게 칠 때 OO는?
하지 말라고 하면서 그냥 일어나서 들어갔어요.
그때 엄마 반응은 어땠어?",,OO,
"속옷을 입고 있었어요,","그러면 이거 말고 일단 OO가 나한테 얘기해 준 게 맨 처음에 옷 다 벗고 비빈 거. 그 다음에도 엄마 저녁 차려드리려고 할 때 허리잡고 비볐다. 그리고 가슴.
이때는 ",,OO,
나가면서,제가 나가면서 봤어요. 거실 쪽이랑 다 보여서 ,,제,
옆에 강아지 보려고,제가 나가면서 봤어요. 거실 쪽이랑 다 보여서 나가면서 옆에 강아지 ,,제,
엄마 도와드리려고,제가 나가면서 봤어요. 거실 쪽이랑 다 보여서 나가면서 옆에 강아지 보려고 하다보고 바로 ,,제,
그쪽에 서 있었어요.,제가 나가면서 봤어요. 거실 쪽이랑 다 보여서 나가면서 옆에 강아지 보려고 하다보고 바로 엄마 도와드리려고 바로 틀어서 ,,제,
그런 꿈을 꿨는데,"근데 제가 그 전에 꿈을 꿨는데 엄마가 임신하는 꿈을 꾼 거예요. 그래서 제가 막 얘기를 하는데 엄마가 되게 해맑게 웃고 있고, ",,제,
기분이 안 좋아서,"근데 제가 그 전에 꿈을 꿨는데 엄마가 임신하는 꿈을 꾼 거예요. 그래서 제가 막 얘기를 하는데 엄마가 되게 해맑게 웃고 있고, 그런 꿈을 꿨는데 그래서 ",,제,
"컴퓨터를 하다가,","근데 제가 그 전에 꿈을 꿨는데 엄마가 임신하는 꿈을 꾼 거예요. 그래서 제가 막 얘기를 하는데 엄마가 되게 해맑게 웃고 있고, 그런 꿈을 꿨는데 그래서 기분이 안 좋아서 ",,제,
거실에서 컴퓨터를 하다가,"근데 제가 그 전에 꿈을 꿨는데 엄마가 임신하는 꿈을 꾼 거예요. 그래서 제가 막 얘기를 하는데 엄마가 되게 해맑게 웃고 있고, 그런 꿈을 꿨는데 그래서 기분이 안 좋아서 컴퓨터를 하다가, ",,제,
"엄마를 보여줬어요,","근데 제가 그 전에 꿈을 꿨는데 엄마가 임신하는 꿈을 꾼 거예요. 그래서 제가 막 얘기를 하는데 엄마가 되게 해맑게 웃고 있고, 그런 꿈을 꿨는데 그래서 기분이 안 좋아서 컴퓨터를 하다가, 거실에서 컴퓨터를 하다가 ",,제,
엄마를 보여줬더니,"근데 제가 그 전에 꿈을 꿨는데 엄마가 임신하는 꿈을 꾼 거예요. 그래서 제가 막 얘기를 하는데 엄마가 되게 해맑게 웃고 있고, 그런 꿈을 꿨는데 그래서 기분이 안 좋아서 컴퓨터를 하다가, 거실에서 컴퓨터를 하다가 엄마를 보여줬어요, 그걸.
뭘 보여줬어?
하다 나왔는데 조혜련이 유산을 했다가 가졌는데 애들이 반응을 어떻게 하나, 그런 동영상이 있었는데 ",,제,
‘아니겠지’ 하면서 하고 있었는데,"근데 제가 그 전에 꿈을 꿨는데 엄마가 임신하는 꿈을 꾼 거예요. 그래서 제가 막 얘기를 하는데 엄마가 되게 해맑게 웃고 있고, 그런 꿈을 꿨는데 그래서 기분이 안 좋아서 컴퓨터를 하다가, 거실에서 컴퓨터를 하다가 엄마를 보여줬어요, 그걸.
뭘 보여줬어?
하다 나왔는데 조혜련이 유산을 했다가 가졌는데 애들이 반응을 어떻게 하나, 그런 동영상이 있었는데 엄마를 보여줬더니 엄마가 되게 기분이 안 좋은 표정으로 보는 거예요, 그걸. 그래서",,제,
계속 나오라고 성질을 내는 거예요.,저희가 그때부터 싫어해 가지고 그 사람을 저희가 부르지 말라고 안 나간다고 이런 식으로 계속 안 나간다고 있었는데 중요한 일이라고 ,,사람,
그래서 나갔더니,중요한 할 말이 있다고. 저희가 그때부터 싫어해 가지고 그 사람을 저희가 부르지 말라고 안 나간다고 이런 식으로 계속 안 나간다고 있었는데 중요한 일이라고 계속 나오라고 성질을 내는 거예요. ,,저희,
“우리한테 귀한 축복이 내려졌다.” 하면서,중요한 할 말이 있다고. 저희가 그때부터 싫어해 가지고 그 사람을 저희가 부르지 말라고 안 나간다고 이런 식으로 계속 안 나간다고 있었는데 중요한 일이라고 계속 나오라고 성질을 내는 거예요. 그래서 나갔더니 ,,사람,
"“엄마가 생명을 잉태했다, 이렇게 말하는 거예요.",중요한 할 말이 있다고. 저희가 그때부터 싫어해 가지고 그 사람을 저희가 부르지 말라고 안 나간다고 이런 식으로 계속 안 나간다고 있었는데 중요한 일이라고 계속 나오라고 성질을 내는 거예요. 그래서 나갔더니 “우리한테 귀한 축복이 내려졌다.” 하면서 ,,사람,
"니들이 집안일을 더 해라.” 이러는 거예요, 저희한테.","그 사람을 저희가 부르지 말라고 안 나간다고 이런 식으로 계속 안 나간다고 있었는데 중요한 일이라고 계속 나오라고 성질을 내는 거예요. 그래서 나갔더니 “우리한테 귀한 축복이 내려졌다.” 하면서 “엄마가 생명을 잉태했다, 이렇게 말하는 거예요. ",,사람,
화가 계속 나는 거예요.,"그래서 그 다음날인가 제가 학원을 갔는데 학원선생님들이랑 옛날부터 알고 지내서 학원선생님들이 저희 가족이야기를 다 안단 말이에요. 엄마가 예전에 어떤 일이 있었고, 새아빠가 있는 것과 저희 아빠도 알고, 새아빠랑도 알고 엄마랑도 아는데 영어선생님이랑, 영어선생님이 앞에서 뭐 나눠주고 외우라고 했었는데",,제,
“무슨 일이 있었던 거 아니냐.”고 하면서 물어보셨단 말이에요.,네. 여자선생님도 알고 다 아는데 여자선생님이 더더욱 잘 알아요. 그래서 “엄마 임신한 거 때문에 그러는 거 아니냐.” 근데 제가 너무 싫다고 하면서 막 얘기를 하니까 ,,여자선생님,
"그래서 그때 말을 했단 말이에요, 여자선생님한테.",근데 제가 너무 싫다고 하면서 막 얘기를 하니까 “무슨 일이 있었던 거 아니냐.”고 하면서 물어보셨단 말이에요.,,제,
“왜 엄마한테 미리 말 안 했냐.” 그런 말 하시다가,그랬더니 선생님이 듣고 화내시면서 ,,선생님,
알고 있었다.,네. “나는 알고 있었다.” 첫 번째 일을 엄마는 말하는 게 아니라 그렇게 비빈다는 걸,,엄마,
“처음에는 이해가 안 갔는데 나중에는...” 이러고 말을 안 하는 거예요.,네. “나는 알고 있었다.” 첫 번째 일을 엄마는 말하는 게 아니라 그렇게 비빈다는 걸 알고 있었다. 그랬더니 선생님이 “그걸 알고도 가만히 있었냐.” 그랬더니 ,,엄마,
자기는 알고 있었다는 식으로 계속 그 얘기만 반복하는 거예요.,네. “나는 알고 있었다.” 첫 번째 일을 엄마는 말하는 게 아니라 그렇게 비빈다는 걸 알고 있었다. 그랬더니 선생님이 “그걸 알고도 가만히 있었냐.” 그랬더니 “처음에는 이해가 안 갔는데 나중에는...” 이러고 말을 안 하는 거예요. “너는 그게 이해가 가냐” 이런 식으로 말을 하는데 ,,엄마,
집에 가려고.,"“너는 그게 이해가 가냐” 이런 식으로 말을 하는데 자기는 알고 있었다는 식으로 계속 그 얘기만 반복하는 거예요. 그러다가 계속 이 얘기를 했더니 엄마가 화를 내면서 쫓아가려고 하는 거예요.
쫓아가려고?
그니까",,엄마,
할머니 집에 가고,"그니까 집에 가려고. 그 사람이 집에 있을 테니까 가서 말하려고. 근데 그러면 새아빠 성격을 아니까 위험할지도 모른다, 하면서 말하지 말고 OO를 보내라고, 외할머니 집에 하루 맡기라고 가라고 그랬는데 엄마가 계속 집에 가자 이러는 거예요. 그래 가지고 선생님이 계속 설득해 가지고 ",,OO,
기분이 안 좋아서,"제가 기분이 안 좋은 거 같으니까, 새아빠가.
잠깐만. 외할머니 집에 갔어.
갔다가 며칠 뒤에 다시 집에 갔어요.
며칠 있다가 집에 갔어.
가서 ",,제,
계속 누워있고 그랬는데,"제가 기분이 안 좋은 거 같으니까, 새아빠가.
잠깐만. 외할머니 집에 갔어.
갔다가 며칠 뒤에 다시 집에 갔어요.
며칠 있다가 집에 갔어.
가서 기분이 안 좋아서 ",,제,
안방에 있었는데,"제가 기분이 안 좋은 거 같으니까, 새아빠가.
잠깐만. 외할머니 집에 갔어.
갔다가 며칠 뒤에 다시 집에 갔어요.
며칠 있다가 집에 갔어.
가서 기분이 안 좋아서 계속 누워있고 그랬는데 제가 어디에 있었는데 안방 밑인가, 위엔가.
아무튼 안방에 있었는데.",,제,
엄마를 계속 불렀는데,안방에 있었는데 제가 누워 있었어요. 근데 그 사람이 약간 안으면서 계속 이랬단 말이에요. 근데 엄마가 주방에 있었어요. 안방이랑 거실이 바로 이렇게 있어서 보인단 말이에요. 그래서 ,,제,
그게 너무 화나서,"안방에 있었는데 제가 누워 있었어요. 근데 그 사람이 약간 안으면서 계속 이랬단 말이에요. 근데 엄마가 주방에 있었어요. 안방이랑 거실이 바로 이렇게 있어서 보인단 말이에요. 그래서 엄마를 계속 불렀는데 엄마가 그냥 못 들은 척 하고 계속 이러고 있는 거예요, 서서. 그래 가지고 ",,제,
그때부터 계속 삐뚤어져 있다가,"안방에 있었는데 제가 누워 있었어요. 근데 그 사람이 약간 안으면서 계속 이랬단 말이에요. 근데 엄마가 주방에 있었어요. 안방이랑 거실이 바로 이렇게 있어서 보인단 말이에요. 그래서 엄마를 계속 불렀는데 엄마가 그냥 못 들은 척 하고 계속 이러고 있는 거예요, 서서. 그래 가지고 그게 너무 화나서 ",,제,
밥 먹으로 갔다가,"그래 가지고 그게 너무 화나서 그때부터 계속 삐뚤어져 있다가 엄마가 밥을 먹으러 가자고 해서, 셋이서만. ",,셋,
계속 화를 내고 있었는데,이렇게 말하니까 제가 그 순간에 너무 화가 나서 ,,제,
"그게 너무 화가 나는 거예요,",이렇게 말하니까 제가 그 순간에 너무 화가 나서 계속 화를 내고 있었는데 엄마가 “그럼 너 아빠한테 가라. 너 아빠는 너 좋아할 줄 아냐” 이렇게 말 하는 거예요. 그래 가지고,,제,
그래서 바로 올라가가지고,"이렇게 말하니까 제가 그 순간에 너무 화가 나서 계속 화를 내고 있었는데 엄마가 “그럼 너 아빠한테 가라. 너 아빠는 너 좋아할 줄 아냐” 이렇게 말 하는 거예요. 그래 가지고 그게 너무 화가 나는 거예요, 그렇게 말하는 자체가. ",,제,
"캐리어에 짐 싸고,","이렇게 말하니까 제가 그 순간에 너무 화가 나서 계속 화를 내고 있었는데 엄마가 “그럼 너 아빠한테 가라. 너 아빠는 너 좋아할 줄 아냐” 이렇게 말 하는 거예요. 그래 가지고 그게 너무 화가 나는 거예요, 그렇게 말하는 자체가. 그래서 바로 올라가가지고 ",,제,
"아무 말도 안하고,","그래 가지고 그게 너무 화가 나는 거예요, 그렇게 말하는 자체가. 그래서 바로 올라가가지고 캐리어에 짐 싸고, 동생은 “언니 죽지 마” 계속 이러다가 엄마 들어오니까 ",,동생,
"안 잡는다고, 가라”고","그래서 바로 올라가가지고 캐리어에 짐 싸고, 동생은 “언니 죽지 마” 계속 이러다가 엄마 들어오니까 아무 말도 안하고, 엄마가 안방에서 “어떻게 상처만 주고 가냐” 하면서 그래 가지고 그냥 계속 그렇게 말하다 제가 진짜 나갈라고 하니까 ",,엄마,
휴대폰이랑 시계랑 돈이랑 다 놓고,"그래 가지고 그게 너무 화가 나는 거예요, 그렇게 말하는 자체가. 그래서 바로 올라가가지고 캐리어에 짐 싸고, 동생은 “언니 죽지 마” 계속 이러다가 엄마 들어오니까 아무 말도 안하고, 엄마가 안방에서 “어떻게 상처만 주고 가냐” 하면서 그래 가지고 그냥 계속 그렇게 말하다 제가 진짜 나갈라고 하니까 “안 잡는다고, 가라”고 이래가지고 ",,제,
옷 챙겨 입고,"그래 가지고 그게 너무 화가 나는 거예요, 그렇게 말하는 자체가. 그래서 바로 올라가가지고 캐리어에 짐 싸고, 동생은 “언니 죽지 마” 계속 이러다가 엄마 들어오니까 아무 말도 안하고, 엄마가 안방에서 “어떻게 상처만 주고 가냐” 하면서 그래 가지고 그냥 계속 그렇게 말하다 제가 진짜 나갈라고 하니까 “안 잡는다고, 가라”고 이래가지고 휴대폰이랑 시계랑 돈이랑 다 놓고 그냥 ",,제,
캐리어 들고 바로 나가서,"그래 가지고 그게 너무 화가 나는 거예요, 그렇게 말하는 자체가. 그래서 바로 올라가가지고 캐리어에 짐 싸고, 동생은 “언니 죽지 마” 계속 이러다가 엄마 들어오니까 아무 말도 안하고, 엄마가 안방에서 “어떻게 상처만 주고 가냐” 하면서 그래 가지고 그냥 계속 그렇게 말하다 제가 진짜 나갈라고 하니까 “안 잡는다고, 가라”고 이래가지고 휴대폰이랑 시계랑 돈이랑 다 놓고 그냥 옷 챙겨 입고 그냥 ",,제,
"계속 걸어갔던 거 같애요, 할머니 집으로.","그래 가지고 그게 너무 화가 나는 거예요, 그렇게 말하는 자체가. 그래서 바로 올라가가지고 캐리어에 짐 싸고, 동생은 “언니 죽지 마” 계속 이러다가 엄마 들어오니까 아무 말도 안하고, 엄마가 안방에서 “어떻게 상처만 주고 가냐” 하면서 그래 가지고 그냥 계속 그렇게 말하다 제가 진짜 나갈라고 하니까 “안 잡는다고, 가라”고 이래가지고 휴대폰이랑 시계랑 돈이랑 다 놓고 그냥 옷 챙겨 입고 그냥 캐리어 들고 바로 나가서 계",,제,
기분 엄청 나빴어.,"그래서 바로 올라가가지고 캐리어에 짐 싸고, 동생은 “언니 죽지 마” 계속 이러다가 엄마 들어오니까 아무 말도 안하고, 엄마가 안방에서 “어떻게 상처만 주고 가냐” 하면서 그래 가지고 그냥 계속 그렇게 말하다 제가 진짜 나갈라고 하니까 “안 잡는다고, 가라”고 이래가지고 휴대폰이랑 시계랑 돈이랑 다 놓고 그냥 옷 챙겨 입고 그냥 캐리어 들고 바로 나가서 계속 걸어갔던 거 같애요, 할머니 집으로.
그러면 외할머니 집에 갔다가 다시 집에 왔잖아요. 다시 집에 왔을 때 안고, 그랬다고 그랬잖아. 그때 어땠어?",,제,
"안보이고, 안 들리는 척하면서","그래서 저는 그때 엄마가 어떻게 해서라도 데리고 나갈 줄 알았는데 그냥 보고, ",,엄마,
계속 주방에 서 있으니까,"그래서 저는 그때 엄마가 어떻게 해서라도 데리고 나갈 줄 알았는데 그냥 보고, 안보이고, 안 들리는 척하면서 계속 ",,엄마,
그게 더 속상했어요.,"그래서 저는 그때 엄마가 어떻게 해서라도 데리고 나갈 줄 알았는데 그냥 보고, 안보이고, 안 들리는 척하면서 계속 주방에 서 있으니까 ",,저,
그렇게 말하는 자체가,"그래서 저는 그때 엄마가 어떻게 해서라도 데리고 나갈 줄 알았는데 그냥 보고, 안보이고, 안 들리는 척하면서 계속 주방에 서 있으니까 그게 더 속상했어요. 제가 말하고 난 다음인데 그렇게 하는 자체가. 그리고 ",,엄마,
"되게 서운하고,",제가 말하고 난 다음인데 그렇게 하는 자체가. 그리고 그렇게 말하는 자체가 ,,제,
엄마한테 실망을 많이 했어요.,"제가 말하고 난 다음인데 그렇게 하는 자체가. 그리고 그렇게 말하는 자체가 되게 서운하고, 되게 ",,제,
